{
  "contract_version": "0.1",
  "comparison_id": "tiny_python.repository_understanding.v1-20260820T201825Z-f5d30f",
  "case_id": "tiny_python.repository_understanding.v1",
  "track": "controlled_model",
  "harness": "codex",
  "model": "gpt-5.6-sol",
  "repetitions": 5,
  "native_run_ids": [
    "native-r1-3df4dbde",
    "native-r2-63fb9bfa",
    "native-r3-e9efcedd",
    "native-r4-bfe1a4ae",
    "native-r5-ef44286e"
  ],
  "logiclens_run_ids": [
    "logiclens-r1-85fdfb38",
    "logiclens-r2-0a48bc1f",
    "logiclens-r3-ffb923f3",
    "logiclens-r4-adc3ff06",
    "logiclens-r5-b593140e"
  ],
  "metrics": {
    "task_success": {
      "native_mean": 0.98,
      "native_stddev": 0.04472135954999579,
      "logiclens_mean": 1,
      "logiclens_stddev": 0.0,
      "paired_delta": 0.019999999999999997,
      "confidence_interval_95": {
        "lower": -0.03551999999999999,
        "upper": 0.07551999999999998,
        "method": "paired t interval, df=4"
      }
    },
    "claim_precision": {
      "native_mean": 0.9714285714285714,
      "native_stddev": 0.06388765649999402,
      "logiclens_mean": 1,
      "logiclens_stddev": 0.0,
      "paired_delta": 0.02857142857142858,
      "confidence_interval_95": {
        "lower": -0.05074285714285716,
        "upper": 0.10788571428571432,
        "method": "paired t interval, df=4"
      }
    },
    "required_fact_recall": {
      "native_mean": 1,
      "native_stddev": 0.0,
      "logiclens_mean": 1,
      "logiclens_stddev": 0.0,
      "paired_delta": 0,
      "confidence_interval_95": {
        "lower": 0.0,
        "upper": 0.0,
        "method": "paired t interval, df=4"
      }
    },
    "evidence_precision": {
      "native_mean": 0.9857142857142858,
      "native_stddev": 0.03194382824999698,
      "logiclens_mean": 1,
      "logiclens_stddev": 0.0,
      "paired_delta": 0.01428571428571428,
      "confidence_interval_95": {
        "lower": -0.025371428571428555,
        "upper": 0.05394285714285711,
        "method": "paired t interval, df=4"
      }
    },
    "unsupported_claim_rate": {
      "native_mean": 0,
      "native_stddev": 0.0,
      "logiclens_mean": 0,
      "logiclens_stddev": 0.0,
      "paired_delta": 0,
      "confidence_interval_95": {
        "lower": 0.0,
        "upper": 0.0,
        "method": "paired t interval, df=4"
      }
    },
    "correct_abstention_rate": {
      "native_mean": 1,
      "native_stddev": 0.0,
      "logiclens_mean": 1,
      "logiclens_stddev": 0.0,
      "paired_delta": 0,
      "confidence_interval_95": {
        "lower": 0.0,
        "upper": 0.0,
        "method": "paired t interval, df=4"
      }
    },
    "false_abstention_rate": {
      "native_mean": 0,
      "native_stddev": 0.0,
      "logiclens_mean": 0,
      "logiclens_stddev": 0.0,
      "paired_delta": 0,
      "confidence_interval_95": {
        "lower": 0.0,
        "upper": 0.0,
        "method": "paired t interval, df=4"
      }
    },
    "relation_precision": {
      "native_mean": 0.955,
      "native_stddev": 0.062249497989943656,
      "logiclens_mean": 1,
      "logiclens_stddev": 0.0,
      "paired_delta": 0.045,
      "confidence_interval_95": {
        "lower": -0.03228056935608069,
        "upper": 0.12228056935608068,
        "method": "paired t interval, df=4"
      }
    },
    "relation_recall": {
      "native_mean": 0.66,
      "native_stddev": 0.13416407864998742,
      "logiclens_mean": 0.92,
      "logiclens_stddev": 0.1095445115010332,
      "paired_delta": 0.26,
      "confidence_interval_95": {
        "lower": 0.017993930654621876,
        "upper": 0.5020060693453782,
        "method": "paired t interval, df=4"
      }
    },
    "wall_ms": {
      "native_mean": 37424.8,
      "native_stddev": 3089.0077209356405,
      "logiclens_mean": 55085.2,
      "logiclens_stddev": 4646.575373326037,
      "paired_delta": 17660.4,
      "confidence_interval_95": {
        "lower": 12720.101787828336,
        "upper": 22600.698212171665,
        "method": "paired t interval, df=4"
      }
    },
    "input_tokens": {
      "native_mean": 47416.8,
      "native_stddev": 290.55326534045355,
      "logiclens_mean": 96998.2,
      "logiclens_stddev": 9948.432474515772,
      "paired_delta": 49581.4,
      "confidence_interval_95": {
        "lower": 37389.74498958507,
        "upper": 61773.05501041493,
        "method": "paired t interval, df=4"
      }
    },
    "output_tokens": {
      "native_mean": 1567.6,
      "native_stddev": 113.9706102466772,
      "logiclens_mean": 2228.6,
      "logiclens_stddev": 103.13486316469324,
      "paired_delta": 661,
      "confidence_interval_95": {
        "lower": 469.6190084924838,
        "upper": 852.3809915075162,
        "method": "paired t interval, df=4"
      }
    },
    "tool_calls": {
      "native_mean": 2,
      "native_stddev": 0.0,
      "logiclens_mean": 4.6,
      "logiclens_stddev": 0.5477225575051661,
      "paired_delta": 2.6,
      "confidence_interval_95": {
        "lower": 1.92002164740339,
        "upper": 3.2799783525966104,
        "method": "paired t interval, df=4"
      }
    }
  }
}
